Questions,Category
What is the smallest unit of matter?,qanda_dataset
What is the main purpose of a fire extinguisher?,qanda_dataset
What is the average speed of a cheetah?,qanda_dataset
What is the significance of the Statue of Liberty?,qanda_dataset
Where is the Taj Mahal located?,qanda_dataset
Where can I find information about local history?,qanda_dataset
Where is the coldest place on Earth?,qanda_dataset
Where is the nearest zoo?,qanda_dataset
Where was the first Olympic Games held?,qanda_dataset
When was the light bulb invented?,qanda_dataset
When was the first modern computer created?,qanda_dataset
When do birds migrate south?,qanda_dataset
When was the first email sent?,qanda_dataset
When does winter begin in the Northern Hemisphere?,qanda_dataset
Why do humans have fingerprints?,qanda_dataset
Why do we celebrate Independence Day?,qanda_dataset
Why do stars shine?,qanda_dataset
Why is education important?,qanda_dataset
Why do people exercise?,qanda_dataset
How do I bake a chocolate cake?,qanda_dataset
How does an airplane take off?,qanda_dataset
How do I set up a Wi-Fi network?,qanda_dataset
How do I create a budget?,qanda_dataset
How does the water cycle work?,qanda_dataset
Who discovered penicillin?,qanda_dataset
Who is the CEO of Tesla?,qanda_dataset
Who created the Marvel Cinematic Universe?,qanda_dataset
Who won the first Nobel Prize?,qanda_dataset
Who was the first woman to win an Olympic gold medal?,qanda_dataset
What is the difference between a virus and a bacteria?,qanda_dataset
What is the role of carbohydrates in the human body?,qanda_dataset
What is the capital of Australia?,qanda_dataset
What is the main function of the human brain?,qanda_dataset
What are the colors of the Olympic rings?,qanda_dataset
Where does coffee originate from?,qanda_dataset
Where can I watch free documentaries online?,qanda_dataset
Where is the largest waterfall in the world?,qanda_dataset
Where does the Danube River flow?,qanda_dataset
Where was the airplane invented?,qanda_dataset
When was the printing press invented?,qanda_dataset
When is the best time to visit Antarctica?,qanda_dataset
When do leaves change color in autumn?,qanda_dataset
When did humans first walk upright?,qanda_dataset
When was the first iPhone released?,qanda_dataset
Why do we recycle plastic?,qanda_dataset
Why do animals hibernate?,qanda_dataset
Why is it important to drink water?,qanda_dataset
Why do people wear sunscreen?,qanda_dataset
Why is teamwork important in sports?,qanda_dataset
How does a solar panel work?,qanda_dataset
How do I clean a coffee maker?,qanda_dataset
How does a rocket launch into space?,qanda_dataset
How do I write a resume?,qanda_dataset
How does the internet work?,qanda_dataset
